{
    "name": "Hello World Module",
    "slug": "hello-module",
    "version": "1.0.0",
    "description": "A sample module to demonstrate LogicDir CMS functionality.",
    "author": "LogicDir Team",
    "entrypoint": "Modules\\HelloModule\\HelloModule",
    "providers": [],
    "priority": 1,
    "permissions": [
        "view-hello-module"
    ],
    "dependencies": {}
}